{
  "paymentId": "11111111-1111-4111-8111-111111111111",
  "attemptId": "22222222-2222-4222-8222-222222222222",
  "providerEvidenceId": "33333333-3333-4333-8333-333333333333",
  "providerReference": "simulator-payment-001",
  "ledgerTransactionId": "44444444-4444-4444-8444-444444444444",
  "completedAt": "2026-07-21T12:00:00Z"
}
